{"$defs":{"classification":{"additionalProperties":false,"properties":{"level":{"enum":["R0","R1","R2","R3","R4","R5","I0","I1","I2","I3","I4","I5"]},"reasons":{"items":{"maxLength":128,"minLength":1,"type":"string"},"maxItems":64,"type":"array"},"state":{"enum":["valid","unknown","invalid"]}},"required":["state","reasons"],"type":"object"},"constraint":{"additionalProperties":false,"properties":{"autonomy_ceiling":{"enum":["R0","R1","R2","R3","R4","R5"]},"conditions":{"items":{"maxLength":128,"minLength":1,"type":"string"},"maxItems":32,"type":"array","uniqueItems":true},"deny_classes":{"items":{"maxLength":128,"minLength":1,"type":"string"},"maxItems":32,"type":"array","uniqueItems":true},"limits":{"additionalProperties":{"maximum":1000000000,"minimum":0,"type":"integer"},"maxProperties":32,"type":"object"},"required_approvals":{"items":{"maxLength":128,"minLength":1,"type":"string"},"maxItems":32,"type":"array","uniqueItems":true},"required_evidence":{"items":{"maxLength":128,"minLength":1,"type":"string"},"maxItems":64,"type":"array","uniqueItems":true},"scope":{"items":{"maxLength":512,"minLength":1,"type":"string"},"maxItems":64,"type":"array","uniqueItems":true}},"type":"object"},"digest":{"pattern":"^[a-f0-9]{64}$","type":"string"},"finding":{"additionalProperties":false,"properties":{"blocking":{"type":"boolean"},"code":{"pattern":"^[a-z0-9][a-z0-9._-]{0,127}$","type":"string"},"detail":{"maxLength":512,"type":"string"}},"required":["code","blocking"],"type":"object"},"owner_ref":{"additionalProperties":false,"properties":{"id":{"maxLength":128,"minLength":1,"type":"string"},"kind":{"const":"owner"},"namespace":{"maxLength":512,"minLength":8,"type":"string"},"version":{"maxLength":32,"type":"string"}},"required":["kind","namespace","id","version"],"type":"object"},"result_ref":{"additionalProperties":false,"properties":{"id":{"maxLength":128,"minLength":1,"type":"string"},"kind":{"const":"governance_result"},"namespace":{"maxLength":512,"minLength":8,"type":"string"},"version":{"maxLength":32,"type":"string"}},"required":["kind","namespace","id","version"],"type":"object"}},"$id":"https://agent-ops.ru/schemas/foundation_governance_result.schema.json","$schema":"https://json-schema.org/draft/2020-12/schema","additionalProperties":false,"allOf":[{"else":{"not":{"required":["outcome"]}},"if":{"properties":{"state":{"const":"valid"}}},"then":{"required":["outcome"]}}],"properties":{"applied_rules":{"items":{"maxLength":128,"minLength":1,"type":"string"},"maxItems":256,"type":"array"},"authority":{"enum":["authoritative_project_source","authoritative_runtime_evidence","governed_policy","human_decision","derived_inference","external_untrusted","development_evidence"]},"autonomy":{"$ref":"#/$defs/classification"},"escalations":{"items":{"maxLength":128,"minLength":1,"type":"string"},"maxItems":64,"type":"array"},"evaluated_at":{"format":"date-time","type":"string"},"findings":{"items":{"$ref":"#/$defs/finding"},"maxItems":128,"type":"array"},"format_version":{"const":"1.0.0"},"impact":{"$ref":"#/$defs/classification"},"input_sha256":{"$ref":"#/$defs/digest"},"modifications":{"$ref":"#/$defs/constraint"},"outcome":{"enum":["allow","deny","modify","escalate"]},"owner_ref":{"$ref":"#/$defs/owner_ref"},"policy_sha256":{"$ref":"#/$defs/digest"},"ref":{"$ref":"#/$defs/result_ref"},"registry_sha256":{"$ref":"#/$defs/digest"},"result_sha256":{"$ref":"#/$defs/digest"},"state":{"enum":["valid","unknown","invalid"]},"valid_until":{"format":"date-time","type":"string"}},"required":["format_version","ref","owner_ref","registry_sha256","input_sha256","policy_sha256","evaluated_at","state","autonomy","impact","findings","authority","result_sha256"],"title":"Gitinsky Foundation Governance Result","type":"object"}